{
  "eventId": "a6a81146-9961-472e-9af8-a4ee9feeb5bc",
  "occurredOn": "2025-05-30T17:08:53.072788037Z",
  "eventType": "RecoveredPlasmaShipmentClosed",
  "eventVersion": "1.0",
  "payload": {
    "locationCode": "123456789",
    "productType": "RP_NONINJECTABLE_LIQUID_RT",
    "shipmentNumber": "{shipmentNumber}",
    "status": "CLOSED",
    "createEmployeeId": "18e41e7a-d06b-47ea-9dc0-3a89ede96bad",
    "transportationReferenceNumber": "DIS-398",
    "shipmentDate": null,
    "cartonTareWeight": 10,
    "createDate": "2025-05-30T17:05:51.916651Z",
    "modificationDate": "2025-05-30T17:08:53.034622Z",
    "closedEmployeeId": "18e41e7a-d06b-47ea-9dc0-3a89ede96bad",
    "closeDate": "2025-05-30T17:08:53.034622Z",
    "customerCode": "409",
    "customerName": "Southern Biologics",
    "customerState": "FL",
    "customerPostalCode": "32303",
    "customerCountry": "USA",
    "customerCountryCode": "USA",
    "customerCity": "Tallahassee",
    "customerDistrict": "",
    "customerAddressLine1": "4801 Woodlane Circle",
    "customerAddressLine2": "Unit 105",
    "customerAddressContactName": null,
    "customerAddressPhoneNumber": null,
    "customerAddressDepartmentName": null,
    "totalCartons": 1,
    "locationShipmentCode": "2765",
    "locationCartonCode": "MH1",
    "cartonList": [
      {
        "cartonNumber": "BPMMH11028",
        "locationCode": "123456789",
        "cartonSequence": 1,
        "closeEmployeeId": "18e41e7a-d06b-47ea-9dc0-3a89ede96bad",
        "closeDate": "2025-05-30T17:06:35.691463Z",
        "productType": "RP_NONINJECTABLE_LIQUID_RT",
        "status": "CLOSED",
        "totalProducts": 1,
        "totalWeight": 0,
        "totalVolume": 0,
        "packedProducts": [
          {
            "unitNumber": "W036825240872",
            "productCode": "E2488V00",
            "packedByEmployeeId": "18e41e7a-d06b-47ea-9dc0-3a89ede96bad",
            "productType": "RP_NONINJECTABLE_LIQUID_RT",
            "volume": 508,
            "weight": 550,
            "aboRh": "AP",
            "donationDate": "2025-05-30T14:54:46.234Z",
            "drawBeginTime": null,
            "collectionFacility": "1FS",
            "collectionTimeZone": "America/New_York"
          }
        ]
      }
    ]
  }
}


